{
  "id": "run_weekly_ops_sync_20260222",
  "workspace_id": "wsp_mindverse_cn",
  "agent_id": "agt_ops_assistant_v1",
  "playbook_id": "pbk_weekly_ops_sync",
  "trigger": {
    "type": "manual",
    "source": "feishu.group:ops-war-room",
    "actor_id": "usr_yingapple",
    "at": "2026-02-22T12:30:00Z"
  },
  "status": "waiting_approval",
  "revision": 1,
  "action_intents": [
    {
      "id": "act_send_weekly_summary",
      "run_id": "run_weekly_ops_sync_20260222",
      "step_id": "send_summary",
      "connector_binding_id": "cnb_feishu_ops_primary",
      "capability": "message.send",
      "side_effect": "mutation",
      "idempotency_key": "run_weekly_ops_sync_20260222_send_summary_v1",
      "risk_hint": "R2",
      "parameters": {
        "chat_id": "oc_xxx",
        "content": "Weekly summary draft..."
      },
      "target": {
        "surface": "feishu.group"
      }
    }
  ],
  "policy_decisions": [
    {
      "id": "pol_approve_send_summary",
      "run_id": "run_weekly_ops_sync_20260222",
      "action_intent_id": "act_send_weekly_summary",
      "decision": "escalate",
      "risk_tier": "R2",
      "reason_codes": [
        "external_message_requires_approval"
      ],
      "required_approvals": 1,
      "policy_trace": {
        "org_policy": "org_default_safe",
        "workspace_policy": "workspace_ops_cn",
        "agent_policy": "agent_ops_assistant",
        "effective_source": "workspace"
      },
      "evaluated_at": "2026-02-22T12:30:05Z"
    }
  ],
  "approval_state": {
    "act_send_weekly_summary": {
      "decision_id": "pol_approve_send_summary",
      "required_approvals": 1,
      "approved_by": []
    }
  },
  "event_stream_ref": "event://runs/run_weekly_ops_sync_20260222",
  "audit_ledger_ref": "ledger://runs/run_weekly_ops_sync_20260222",
  "started_at": "2026-02-22T12:30:00Z"
}
